{"aggregates":{"greedy":{"decision_cost_centimes":182346500,"relocation_cost_centimes":2346500,"scenario_count":48,"served_demand":552,"service_rate":"0.754098","total_demand":732,"unserved_demand":180},"no_relocation":{"decision_cost_centimes":348000000,"relocation_cost_centimes":0,"scenario_count":48,"served_demand":384,"service_rate":"0.524590","total_demand":732,"unserved_demand":348},"ortools_min_cost_flow":{"decision_cost_centimes":19545000,"relocation_cost_centimes":7545000,"scenario_count":48,"served_demand":720,"service_rate":"0.983607","total_demand":732,"unserved_demand":12}},"benchmark":{"currency":"MAD","data_status":"SYNTHETIC_NOT_RENTFLEET_NOT_LOCAL_ACCURACY","distance_unit":"km","kind":"DETERMINISTIC_SYNTHETIC_STRESS_SUITE","presence_probability":"1.000000","presence_reason":"CATBOOST_RESEARCH_GATE_NOT_PASSED_CONSERVATIVE_NO_DISCOUNT","scenario_count":48,"seed":20260814,"snapshot_sha256":"53d79202807b2952dc95154e0116153664f202007807a0855a16cbea63cc4214"},"decision":"QUALIFIED_FOR_CONSULTATIVE_SAAS_INTEGRATION_REVIEW","gate_passed":true,"gates":{"checks":{"aggregate_service_rate":true,"decision_cost_better_than_greedy":true,"decision_cost_better_than_no_relocation":true,"invariant_valid_solution_rate":true,"optimal_solution_rate":true,"runtime_under_5000_ms":true,"unserved_better_than_greedy":true,"unserved_better_than_no_relocation":true},"observed":{"aggregate_service_rate":"0.983607","invariant_valid_solution_rate":"1.000000","maximum_single_solve_runtime_gate_passed":true,"optimal_solution_rate":"1.000000"},"passed":true},"protocol_version":"1.0.0","safety":{"automatic_business_write_allowed":false,"catboost_output_consumed":false,"human_validation_required":true,"local_rentfleet_status":"NOT_VALIDATED_NO_REAL_HISTORY","saas_integration_allowed":true},"solver":{"cost_integrality":"centimes","name":"Google OR-Tools SimpleMinCostFlow","required_status":"OPTIMAL","version":"9.15.6755"}}
